<!ELEMENT classe  (alumne+)>
<!ELEMENT alumne   (nif, nom, cognom+)>
<!ELEMENT nif       (#PCDATA)>
<!ELEMENT nom       (#PCDATA)>
<!ELEMENT cognom    (#PCDATA)>

<!ATTLIST nif id ID #REQUIRED>
<!ATTLIST nom nom CDATA #REQUIRED>